title,authors,journal,publish_time
COVID-19 Vaccine Development,Smith J; Brown K,Nature,2020-05-01
Impact of Lockdowns on Public Health,Lopez M; Singh R,The Lancet,2020-08-15
AI in Pandemic Response,Chen L; Wang H,Journal of AI Research,2021-01-10
Mental Health Challenges During COVID-19,Johnson P; Ahmed Y,BMJ,2021-06-20
Genomic Analysis of SARS-CoV-2,Davis R; Miller S,Science,2019-12-25
Long-term Effects of COVID-19,Garcia F; Kim H,Nature Medicine,2021-09-30
Global Vaccination Strategies,Patel A; O'Neill P,Vaccine,2021-12-05
COVID-19 and Education Disruption,Martinez L; Rossi G,Educational Review,2020-11-11
Pandemic Preparedness with AI,Zhang X; Lee D,AI Journal,2022-03-01
Economic Impact of COVID-19,White K; Black T,Economic Studies,2020-04-05
